{
  "schemaVersion": "cff.html5assay.policy.v1",
  "id": "cff-web-balanced",
  "version": "1.0.0",
  "profile": "balanced",
  "reviewDate": "2026-08-19",
  "levels": {
    "H5A-CFF-001": "advisory",
    "H5A-CFF-002": "advisory",
    "H5A-CFF-006": "advisory",
    "H5A-PERF-004": "advisory",
    "H5A-THEME-001": "advisory",
    "H5A-THEME-002": "advisory",
    "H5A-THEME-003": "advisory",
    "H5A-THEME-004": "advisory",
    "H5A-THEME-005": "advisory",
    "H5A-THEME-006": "advisory"
  },
  "limits": {
    "inputFiles": 10000,
    "bytesPerTextFile": 4194304,
    "totalAnalyzedBytes": 67108864,
    "htmlNodesPerDocument": 250000,
    "cssRulesPerGraph": 100000,
    "localReferenceDepth": 32,
    "findings": 20000
  },
  "pageBudgets": { "default": 768000, "playground": 2097152 },
  "allowedFormActions": ["", "/search"],
  "suppressions": []
}
